    <!ELEMENT bookstore (description, book+)>
    <!ELEMENT description (#PCDATA)>
    <!ELEMENT book (title, price)>
    <!ELEMENT title (#PCDATA)>
    <!ATTLIST title lang (en|pt) "en">
    <!ELEMENT price (#PCDATA)>